{
  "schema_version": "1.0",
  "task_id": "task_launch_campaign",
  "latest_sequence": 3,
  "latest_proposal_revision": 1,
  "active_run": {
    "run_id": "run_launch_plan_01",
    "message_id": "message_launch_brief",
    "status": "PLAN_READY",
    "started_at": "2026-08-22T09:02:00Z",
    "updated_at": "2026-08-22T09:03:00Z"
  },
  "last_error": null,
  "revision": 4,
  "created_at": "2026-08-22T09:02:00Z",
  "updated_at": "2026-08-22T09:03:00Z"
}
